{
  "$id": "https://example.org/hpo-translations/ontology-network/review_pack_record.schema.json",
  "$schema": "https://json-schema.org/draft/2020-12/schema",
  "additionalProperties": false,
  "properties": {
    "agent_panel_assessment_required": {
      "type": "boolean"
    },
    "agent_panel_role": {
      "type": "string"
    },
    "candidate_count": {
      "type": "integer"
    },
    "candidate_only": {
      "type": "boolean"
    },
    "conflict_ids": {
      "items": {
        "type": "string"
      },
      "type": "array"
    },
    "coverage_ids": {
      "items": {
        "type": "string"
      },
      "type": "array"
    },
    "crosswalk_ids": {
      "items": {
        "type": "string"
      },
      "type": "array"
    },
    "hpo_ids": {
      "items": {
        "type": "string"
      },
      "type": "array"
    },
    "language": {
      "type": "string"
    },
    "maintainer_promotion_decision_required": {
      "type": "boolean"
    },
    "pack_id": {
      "type": "string"
    },
    "promotion_policy": {
      "type": "string"
    },
    "provenance_id": {
      "type": "string"
    },
    "scope": {
      "type": "string"
    },
    "source_ids": {
      "items": {
        "type": "string"
      },
      "type": "array"
    }
  },
  "required": [
    "agent_panel_assessment_required",
    "candidate_only",
    "conflict_ids",
    "coverage_ids",
    "crosswalk_ids",
    "hpo_ids",
    "language",
    "maintainer_promotion_decision_required",
    "pack_id",
    "promotion_policy",
    "provenance_id",
    "scope",
    "source_ids"
  ],
  "title": "review_pack_record",
  "type": "object",
  "x-schema-version": "2.0.0"
}
