[
  {
    "agent_panel_assessment_required": true,
    "agent_panel_role": "language-specialist agent panel",
    "candidate_count": 0,
    "candidate_only": true,
    "conflict_ids": [
      "conflict-fail-fast-1"
    ],
    "coverage_ids": [
      "coverage-fail-fast-1"
    ],
    "crosswalk_ids": [
      "probe-open-related-0001"
    ],
    "hpo_ids": [
      "HP:0000001"
    ],
    "language": "en",
    "maintainer_promotion_decision_required": true,
    "pack_id": "pack-en-fail-fast",
    "promotion_policy": "maintainer_decision_after_agent_panel_assessment",
    "provenance_id": "prov-review-pack-fail-fast",
    "scope": "ontology-network fail-fast metadata probe",
    "source_ids": [
      "do",
      "decipher"
    ]
  }
]
